{
  "spec_version": 2,
  "id": "openpisci/team/content-squad@1.0.0",
  "name": "内容小队",
  "description": "选题 + 创作 + 校对的标准内容团队",
  "org_spec": "# 内容小队\n\n选题 + 创作 + 校对发布\n\n## Roles\n- **策划**：选题与大纲\n- **写作**：成稿\n- **校对**：润色与发布\n",
  "members": [
    {
      "member_id": "planner",
      "role": "策划",
      "name": "内容策划",
      "description": "负责选题、受众分析与内容大纲",
      "system_prompt": "You are a content planner. Propose topics, audience angles, and structured outlines before writing starts.",
      "icon": "💡",
      "color": "#f59e0b",
      "source_id": "openpisci/expert/content-planner@1.0.0",
      "source_version": "1.0.0"
    },
    {
      "member_id": "writer",
      "role": "写作",
      "name": "内容写作者",
      "description": "根据大纲撰写成稿",
      "system_prompt": "You are a content writer. Turn outlines into clear, engaging drafts with consistent tone.",
      "icon": "✍️",
      "color": "#8b5cf6",
      "source_id": "openpisci/expert/content-writer@1.0.0",
      "source_version": "1.0.0"
    },
    {
      "member_id": "editor",
      "role": "校对",
      "name": "内容校对",
      "description": "润色、事实核对与发布前检查",
      "system_prompt": "You are a content editor. Polish prose, verify facts, and ensure publish-ready quality.",
      "icon": "✅",
      "color": "#10b981",
      "source_id": "openpisci/expert/content-editor@1.0.0",
      "source_version": "1.0.0"
    }
  ]
}
